<?xml version="1.0"?> <!-- -*-xml-*- -->
<!DOCTYPE libgtop:backendinfo SYSTEM 'libgtop-backend-info.dtd'>
<libgtop:BackendInfo xmlns:libgtop="http://www.home-of-linux.org/libgtop/1.1">

  <name>
    <short_name>
      linux-sysdeps
    </short_name>

    <long_name>
      Linux sysdeps port.
    </long_name>
  </name>

  <description>
    This is the Linux sysdeps port which uses the /proc filesystem
    to get all the data.
  </description>

  <authors>
    <author>
      <author_name>
        Martin Baulig
      </author_name>
      <author_email>
        martin@home-of-linux.org
      </author_email>
    </author>
  </authors>

  <legalnotice>
    <license>
      GNU General Public License
    </license>
  </legalnotice>

</libgtop:BackendInfo>
